{"id": "rubric-cs-lab-report-generic", "version": "1.0.0", "title": "高校计算机专业实验报告通用 Rubric（进程线程同步 / Socket 网络编程 / 排序算法性能对比）", "items": [{"id": "R1", "name": "实验目的理解", "weight": 5, "maxScore": 5, "evidenceRequirement": "证据类型：text。要求报告「实验目的」章节中明确列出本次实验要验证/实现的 2 条以上目标，且目标动词具体（如「验证信号量对临界区的保护作用」「对比三种排序在 10 万级数据下的耗时」），能与后文实验内容与结论一一对应。", "levels": [{"level": "excellent", "label": "优秀", "criterion": "列出 3 条以上具体目标，覆盖知识目标（要懂什么）与能力目标（要做出什么），且后文每个目标都有对应结果与结论回应", "scoreRatio": 1}, {"level": "meeting", "label": "达标", "criterion": "列出 2–3 条目标，表述基本清晰，与后文内容大体对应，但个别目标缺少结果回应", "scoreRatio": 0.8}, {"level": "partial", "label": "部分达标", "criterion": "仅有 1 条笼统目标（如「学习多线程编程」），或目标抄自实验指导书而无个人化表述", "scoreRatio": 0.5}, {"level": "notMet", "label": "未达标", "criterion": "无实验目的章节，或目的与本次实验主题明显无关", "scoreRatio": 0}], "deductionNotes": "在档位基础上浮动：目标条目数达标但存在 1 条与后文无对应，降一档处理（如优秀降达标）；出现与实验主题无关的目标，每条再扣 0.5 分（最低降至未达标）。"}, {"id": "R2", "name": "原理阐述", "weight": 12, "maxScore": 10, "evidenceRequirement": "证据类型：text、code、figure。要求报告「实验原理」章节正确阐述核心概念（如临界区与互斥、TCP 三次握手与粘包、排序复杂度与主存访问局部性），术语使用准确，能结合本次实验的关键数据结构或系统调用说明机制；原理中提到的机制须能在后文代码中找到对应实现。", "levels": [{"level": "excellent", "label": "优秀", "criterion": "概念定义准确且完整，能说明机制「为什么成立」（如信号量 PV 操作为何能保证互斥、TCP 为何是字节流），并结合代码/数据结构给出具体说明，无科学性错误", "scoreRatio": 1}, {"level": "meeting", "label": "达标", "criterion": "核心概念表述正确，覆盖了主要机制，但停留在定义复述层面，未深入解释成因或与代码的对应关系偏弱", "scoreRatio": 0.8}, {"level": "partial", "label": "部分达标", "criterion": "仅零散提及术语，存在概念混淆（如把进程与线程混为一谈、把互斥与同步混为一谈、错误描述平均/最坏时间复杂度），篇幅明显不足", "scoreRatio": 0.5}, {"level": "notMet", "label": "未达标", "criterion": "完全缺失原理阐述，或阐述存在原则性科学错误（如认为信号量可以解决一切死锁、认为 TCP 天然保证消息边界）", "scoreRatio": 0}], "deductionNotes": "每出现一处科学性错误在档位基础上再扣 2 分，出现原则性错误直接判未达标；原理与实现完全脱节（阐述 A 机制却实现 B）扣 3 分；整段照抄教材且无任何自己的归纳表述扣 1 分。"}, {"id": "R3", "name": "实验环境配置", "weight": 5, "maxScore": 5, "evidenceRequirement": "证据类型：text、table、figure。要求报告给出可复现的环境信息：操作系统与版本、编译器/解释器与版本、关键依赖库或内核头文件版本、编译命令或运行命令；建议以表格或截图形式呈现。", "levels": [{"level": "excellent", "label": "优秀", "criterion": "OS、语言/编译器版本、依赖库版本、编译与运行命令四要素齐全，并给出关键版本号（如 gcc 11.4.0、Python 3.11.6、glibc 2.35），他人可据此复现", "scoreRatio": 1}, {"level": "meeting", "label": "达标", "criterion": "给出了 OS 与主要工具版本，缺少个别次要信息（如未给依赖库版本或未给编译命令），基本可复现", "scoreRatio": 0.8}, {"level": "partial", "label": "部分达标", "criterion": "只写了工具名称而无版本号（如仅写「Ubuntu + gcc」），或只给了一张无法辨识版本信息的截图", "scoreRatio": 0.5}, {"level": "notMet", "label": "未达标", "criterion": "完全未交代环境信息", "scoreRatio": 0}], "deductionNotes": "缺版本号每处扣 1 分；缺编译/运行命令扣 1 分；版本号与实际代码语法明显矛盾（如写 Python 2 却用 f-string）扣 2 分；仅以截图呈现且图中文字不可辨识，降一档处理。"}, {"id": "R4", "name": "实验步骤完整性", "weight": 7, "maxScore": 10, "evidenceRequirement": "证据类型：text、code、figure。要求报告给出可操作的步骤序列：环境准备 → 代码编写 → 编译/构建 → 运行与参数 → 观察记录 → 结果导出，步骤顺序合理、有编号，关键步骤附命令或截图。", "levels": [{"level": "excellent", "label": "优秀", "criterion": "步骤编号完整且与实验流程一致，覆盖准备、实现、编译、运行、记录、导出六个环节，关键步骤给出具体命令与参数，他人可按步骤复现实验", "scoreRatio": 1}, {"level": "meeting", "label": "达标", "criterion": "步骤基本完整且顺序合理，覆盖主要环节，但个别环节无命令或参数说明，缺少结果导出/归档环节", "scoreRatio": 0.8}, {"level": "partial", "label": "部分达标", "criterion": "只有粗略的几步（如「写代码→运行」），缺少编译、参数、记录等关键环节，或步骤顺序混乱", "scoreRatio": 0.5}, {"level": "notMet", "label": "未达标", "criterion": "无实验步骤章节，或步骤与本次实验内容无关", "scoreRatio": 0}], "deductionNotes": "缺失一个关键环节（编译/运行参数/结果记录）扣 2 分；步骤编号缺失或顺序颠倒扣 1 分；步骤中出现与代码不一致的命令（如源文件名对不上）每处扣 1 分。"}, {"id": "R5", "name": "核心代码正确性", "weight": 20, "maxScore": 20, "evidenceRequirement": "证据类型：code、text。要求报告给出核心实现的代码块（带语言标注），代码能完成实验要求的核心功能且逻辑正确：临界区保护无遗漏、套接字收发与关闭正确、排序结果有序且稳定；须关注边界条件（空输入、单元素、并发冲突、连接异常断开）。", "levels": [{"level": "excellent", "label": "优秀", "criterion": "核心功能完全正确，边界条件处理完备（如空输入/单元素/连接异常/并发极端情况），无资源泄漏（锁必然释放、fd 必然关闭、内存必然回收），并有错误处理与返回值检查", "scoreRatio": 1}, {"level": "meeting", "label": "达标", "criterion": "主要功能正确，常规输入下结果正确，但边界条件或异常处理有遗漏（如未检查系统调用返回值、未处理连接断开），不影响主流程", "scoreRatio": 0.8}, {"level": "partial", "label": "部分达标", "criterion": "代码存在可指出的明确缺陷（如锁的粒度错误、未加锁保护共享变量、recv 返回值未处理导致粘包、排序比较逻辑有误），在部分输入下会产生错误结果", "scoreRatio": 0.5}, {"level": "notMet", "label": "未达标", "criterion": "无核心代码块，或代码无法通过编译/运行，或核心逻辑完全错误（如根本未使用实验要求的机制）", "scoreRatio": 0}], "deductionNotes": "每处明确 bug 扣 3 分（资源泄漏每处额外扣 2 分）；代码无法编译直接判未达标；仅贴出运行结果而无代码，判未达标；核心代码与实验要求机制不符（如要求用信号量却用忙等）扣 5 分。"}, {"id": "R6", "name": "关键 API / 算法使用", "weight": 10, "maxScore": 10, "evidenceRequirement": "证据类型：code、text。要求报告正确使用了本实验的关键 API 或算法：如 pthread_mutex_lock/unlock、sem_wait/sem_post、socket/bind/listen/accept/send/recv、快排分区与递归、归并合并等；调用参数与惯用法正确，并在正文中说明为何选用该 API/算法。", "levels": [{"level": "excellent", "label": "优秀", "criterion": "关键 API/算法选用恰当且调用惯用法完全正确，参数与返回值处理规范，并说明了选型理由与替代方案对比", "scoreRatio": 1}, {"level": "meeting", "label": "达标", "criterion": "使用了正确的关键 API/算法，调用基本规范，但未说明选型理由，或个别参数使用不够地道（如未复用地址、未设置超时）", "scoreRatio": 0.8}, {"level": "partial", "label": "部分达标", "criterion": "使用了实验要求的 API/算法但用法有误（如互斥锁与条件变量配合错误、忘记 setsockopt、递归终止条件写错），或回避了关键 API 而用简化替代实现", "scoreRatio": 0.5}, {"level": "notMet", "label": "未达标", "criterion": "完全未使用实验要求的关键 API/算法（如要求用 socket 却直接用现成框架、要求实现快排却直接调用库排序且未作说明）", "scoreRatio": 0}], "deductionNotes": "关键 API 参数错误每处扣 2 分；调用了被废弃/不安全的接口（如 strcpy、gets）每处扣 2 分；使用了库函数但明确说明并对比了自实现版本，不扣分。"}, {"id": "R7", "name": "实验结果与截图", "weight": 11, "maxScore": 10, "evidenceRequirement": "证据类型：figure、table、text。要求报告提供支撑结论的原始结果：终端运行输出截图、程序界面/输出窗口截图、性能数据表格等；每张图须有编号与图题，图题说明该图展示了什么，图中关键数据可辨识，并在正文中被引用（如「如图 3-2 所示」）。", "levels": [{"level": "excellent", "label": "优秀", "criterion": "提供 3 张以上结果截图/表格，覆盖主要实验场景（如并发前后对比、多组规模数据），每张有编号与图题，图中关键数据清晰可辨识，且正文逐一引用并解读", "scoreRatio": 1}, {"level": "meeting", "label": "达标", "criterion": "提供了 2 张左右结果截图，编号与图题基本齐全，能支撑主要结论，但个别场景缺少截图或图中部分数据不可辨识", "scoreRatio": 0.8}, {"level": "partial", "label": "部分达标", "criterion": "仅有 1 张截图，或截图缺少编号/图题，或截图与实验内容不匹配（如只截了代码编辑界面而无运行结果），不足以支撑结论", "scoreRatio": 0.5}, {"level": "notMet", "label": "未达标", "criterion": "完全没有结果截图或结果数据，结论无证据支撑", "scoreRatio": 0}], "deductionNotes": "截图无编号或图题每张扣 1 分；截图未被正文引用每张扣 1 分；截图为伪造/明显与实验无关（如网络图片、仅截代码）判部分达标并扣 3 分；结果数据未以表格呈现导致难以比对，扣 2 分。"}, {"id": "R8", "name": "数据分析与讨论", "weight": 13, "maxScore": 15, "evidenceRequirement": "证据类型：text、table、figure。要求报告对结果数据做量化分析而非现象罗列：给出具体数值与对比（如加速比、耗时增长率、并发下错误计数差值），解释数据背后的成因（如缓存局部性、锁竞争开销、Nagle 算法影响），并能与理论预期做对照，说明偏差原因。", "levels": [{"level": "excellent", "label": "优秀", "criterion": "给出多组量化数据对比与计算（如加速比、增长率、相对误差），结合原理深入解释成因，明确指出与理论预期的偏差并给出可信解释，讨论有个人见解", "scoreRatio": 1}, {"level": "meeting", "label": "达标", "criterion": "有量化数据对比与基本解释，能说明主要趋势（如规模增大耗时上升、加锁后吞吐下降），但归因较浅或未与理论值对照", "scoreRatio": 0.8}, {"level": "partial", "label": "部分达标", "criterion": "只罗列现象而无量化分析（如「加了锁之后变慢了」却不给数值），或仅有结论无数据支撑，分析泛泛而谈", "scoreRatio": 0.5}, {"level": "notMet", "label": "未达标", "criterion": "完全没有数据分析与讨论，直接跳到总结", "scoreRatio": 0}], "deductionNotes": "数据存在明显矛盾（图表数值与正文描述不一致）每处扣 3 分；仅重复描述截图内容而无分析，降一档；量化样本量过少（仅 1 组数据即下结论）扣 3 分；结论超出数据支持范围（过度外推）扣 2 分。"}, {"id": "R9", "name": "问题排查与反思", "weight": 7, "maxScore": 10, "evidenceRequirement": "证据类型：text、code、figure。要求报告记录实验过程中遇到的真实问题（编译报错、死锁、结果不稳定、性能异常等），给出排查过程与解决办法，并反思方案局限与改进方向；问题须具体可复现，而非泛泛而谈。", "levels": [{"level": "excellent", "label": "优秀", "criterion": "记录 2 个以上具体问题，含现象、定位过程（用了什么手段定位）、根因与解决办法，并给出方案局限与至少 1 条可执行的改进方向", "scoreRatio": 1}, {"level": "meeting", "label": "达标", "criterion": "记录了 1–2 个问题并给出解决办法，但排查过程描述简略，或反思偏套话、缺乏可执行改进方向", "scoreRatio": 0.8}, {"level": "partial", "label": "部分达标", "criterion": "仅笼统提到「遇到了一些困难」而未说明具体问题与解决办法，或只写了反思而无问题记录", "scoreRatio": 0.5}, {"level": "notMet", "label": "未达标", "criterion": "完全无问题排查与反思内容", "scoreRatio": 0}], "deductionNotes": "问题已提出但未给出解决办法，每个扣 2 分；解决办法与问题不匹配（如把编译错误当成逻辑错误处理）扣 3 分；反思内容空洞套话（如「以后要更加努力」）扣 2 分。"}, {"id": "R10", "name": "代码规范", "weight": 5, "maxScore": 10, "evidenceRequirement": "证据类型：code。要求代码块带语言标注，命名有意义且风格统一，缩进一致，关键分支与函数有注释说明意图，无魔法数字（或已定义为常量），无调试残留（printf 调试语句、注释掉的大段代码）。", "levels": [{"level": "excellent", "label": "优秀", "criterion": "命名规范统一，缩进与空行一致，关键函数与复杂逻辑有注释说明「为什么」，常量已提取命名，无调试残留，代码块均带语言标注", "scoreRatio": 1}, {"level": "meeting", "label": "达标", "criterion": "整体可读，命名与缩进基本规范，但注释偏少或仅描述「做了什么」，存在个别魔法数字或少量调试残留", "scoreRatio": 0.8}, {"level": "partial", "label": "部分达标", "criterion": "命名随意（a、b、tmp1）或缩进混乱，几乎无注释，代码块缺少语言标注，存在大段注释掉的代码", "scoreRatio": 0.5}, {"level": "notMet", "label": "未达标", "criterion": "代码以截图形式给出无法复制、或代码完全无法辨认、或未给出任何代码块", "scoreRatio": 0}], "deductionNotes": "每处无意义命名扣 0.5 分；每处调试残留（调试打印、注释掉的整段代码）扣 1 分；代码块缺语言标注每处扣 1 分；代码以图片代替文本直接降一档。"}, {"id": "R11", "name": "格式规范", "weight": 3, "maxScore": 10, "evidenceRequirement": "证据类型：text、figure、table。要求报告具备完整结构（目的/原理/环境/步骤/代码/结果/分析/总结），标题层级清晰，图表有编号与题注，参考文献（如教材、RFC、官方文档）标注规范，无大面积空白或排版错乱。", "levels": [{"level": "excellent", "label": "优秀", "criterion": "章节结构完整，标题层级清晰，图表编号连续且题注规范，引用标注规范，排版整洁", "scoreRatio": 1}, {"level": "meeting", "label": "达标", "criterion": "结构基本完整，图表有编号，但存在个别章节缺失、编号不连续或参考文献格式不统一", "scoreRatio": 0.8}, {"level": "partial", "label": "部分达标", "criterion": "缺少 2 个以上必要章节，或标题层级混乱，图表无编号，篇幅明显不足", "scoreRatio": 0.5}, {"level": "notMet", "label": "未达标", "criterion": "结构严重缺失（如只有代码没有正文），或全文无标题层级、无法辨识章节", "scoreRatio": 0}], "deductionNotes": "缺失一个必要章节扣 2 分；图表编号缺失或不连续每处扣 0.5 分；篇幅低于本实验规定下限（如优档 < 1500 字）扣 2 分；复制他人排版模板未改（出现其他实验的残留标题）扣 2 分。"}, {"id": "R12", "name": "原创性", "weight": 2, "maxScore": 5, "evidenceRequirement": "证据类型：text、code。要求报告体现个人独立完成痕迹：参数选取、测试用例设计、数据表格由本人实验产生，核心代码非整段照抄网络或同学；引用他人代码或资料须注明出处。", "levels": [{"level": "excellent", "label": "优秀", "criterion": "参数与测试用例有个人设计痕迹（如自行设定的并发规模、数据集构造方式），数据与代码一致，引用处均注明出处", "scoreRatio": 1}, {"level": "meeting", "label": "达标", "criterion": "整体为独立完成，个别片段参考公开资料但未注明出处，或参数完全照搬实验指导书默认值", "scoreRatio": 0.8}, {"level": "partial", "label": "部分达标", "criterion": "存在明显照抄痕迹（代码风格与正文描述割裂、数据与他人雷同），但未发现直接复制的整段内容", "scoreRatio": 0.5}, {"level": "notMet", "label": "未达标", "criterion": "确认存在整段抄袭（代码或正文与他人完全一致且无引用标注）", "scoreRatio": 0}], "deductionNotes": "发现未标注引用的参考内容每段扣 1 分；数据明显伪造（如性能数据违背基本规律）扣 2 分；确认抄袭直接判未达标并按课程学术规范另行处理，本项不得分。"}]}